{"schema_version":"2.0.0","node_id":"lab-02-bmp-oled","board":{"platform":"esp32-c3","variant":"esp32-c3-supermini","capability_version":"1.0.0"},"runtime":{"health_report_interval_ms":1000,"max_device_tasks":4,"queue_depth":8,"configuration_source":"usb_serial","rollback_on_error":true},"interfaces":[{"id":"i2c0","protocol":"i2c","port":0,"sda_gpio":0,"scl_gpio":1,"clock_hz":100000},{"id":"spi2","protocol":"spi","host":2,"mosi_gpio":6,"sclk_gpio":7,"clock_hz":4000000}],"queues":[{"id":"telemetry.environment","item_type":"environment_sample","depth":8,"overflow_policy":"drop_oldest"},{"id":"system.health","item_type":"health_event","depth":8,"overflow_policy":"drop_oldest"},{"id":"distance.front","item_type":"distance_sample","depth":8,"overflow_policy":"drop_oldest"}],"devices":[{"device_id":"environment_sensor","driver":"bmp388","enabled":true,"interface":{"ref":"i2c0","address":"0x77"},"behaviour":{"profile":"periodic_sensor","operation":"read","interval_ms":500,"timeout_ms":100,"destination":"telemetry.environment"},"task":{"name":"bmp388_reader","priority":12,"stack_size_bytes":3072},"descriptor":{"id":"bmp388","version":"1.0.0"}},{"device_id":"oled_status","driver":"ssd1306_spi","enabled":true,"interface":{"ref":"spi2","cs_gpio":4,"dc_gpio":3,"reset_gpio":10},"display":{"width_px":128,"height_px":64},"behaviour":{"profile":"queue_display","operation":"render","refresh_interval_ms":250,"timeout_ms":20,"sources":["telemetry.environment","system.health"]},"task":{"name":"oled_renderer","priority":16,"stack_size_bytes":3072},"descriptor":{"id":"ssd1306_spi","version":"1.0.0"}},{"device_id":"front_range","driver":"hc_sr04","enabled":true,"interface":{"protocol":"gpio","trigger_gpio":4,"echo_gpio":5,"echo_voltage_divider_required":true},"behaviour":{"profile":"periodic_sensor","operation":"measure_distance","interval_ms":1000,"timeout_us":30000,"destination":"distance.front"},"task":{"name":"hc_sr04_reader","priority":10,"stack_size_bytes":3072},"descriptor":{"id":"hc_sr04","version":"1.0.0"}}]}