{"schema_version":"2.1.0","node_id":"lab-01-bmp","board":{"platform":"esp32-c3","variant":"esp32-c3-supermini","capability_version":"1.0.0"},"runtime":{"health_report_interval_ms":1000,"max_device_tasks":4,"queue_depth":8,"configuration_source":"usb_serial","rollback_on_error":true},"interfaces":[{"id":"i2c0","protocol":"i2c","port":0,"sda_gpio":0,"scl_gpio":1,"clock_hz":100000}],"queues":[{"id":"telemetry.environment","item_type":"environment_sample","depth":8,"overflow_policy":"drop_oldest"},{"id":"system.health","item_type":"health_event","depth":8,"overflow_policy":"drop_oldest"}],"devices":[{"device_id":"environment_sensor","driver":"bmp388","enabled":true,"interface":{"ref":"i2c0","address":"0x77"},"behaviour":{"profile":"periodic_sensor","operation":"read","interval_ms":500,"timeout_ms":100,"destination":"telemetry.environment"},"task":{"name":"bmp388_reader","priority":12,"stack_size_bytes":3072},"descriptor":{"id":"bmp388","version":"1.0.0"}},{"device_id":"output.main","driver":"pwm_output","descriptor":{"id":"pwm_output","version":"1.0.0"},"enabled":true,"interface":{"protocol":"gpio","output_gpio":5},"behaviour":{"profile":"rule_output","operation":"set_duty","interval_ms":50,"timeout_ms":1,"frequency_hz":1000},"task":{"name":"output_main","priority":12,"stack_size_bytes":3072}}],"rules":[{"source":"environment_sensor","target":"output.main","metric":"temperature_centi_c","comparison":"above","threshold":3000,"hysteresis":100,"cooldown_ms":200,"max_age_ms":500,"duty_permille":500}]}